{
  "schema_version": "0.1.0",
  "scoreboard_id": "scoreboard-schema-smoke-001",
  "run_id": "eval-run-schema-smoke-001",
  "session_id": "harness-agent-runner-example",
  "harness_version": "0.1.0",
  "generated_at": "2026-05-21T00:00:00Z",
  "status": "passed",
  "splits": [
    {
      "split": "optimization",
      "total": 2,
      "passed": 1,
      "failed": 1,
      "error": 0,
      "failure_buckets": {
        "agent-failure": 1,
        "model-failure": 0,
        "harness-error": 0,
        "verifier-error": 0,
        "verification-failure": 0,
        "budget-exceeded": 0,
        "credential-missing": 0
      }
    },
    {
      "split": "holdout",
      "total": 0,
      "passed": 0,
      "failed": 0,
      "error": 0,
      "failure_buckets": {
        "agent-failure": 0,
        "model-failure": 0,
        "harness-error": 0,
        "verifier-error": 0,
        "verification-failure": 0,
        "budget-exceeded": 0,
        "credential-missing": 0
      }
    }
  ],
  "totals": {
    "total": 2,
    "passed": 1,
    "failed": 1,
    "error": 0,
    "failure_buckets": {
      "agent-failure": 1,
      "model-failure": 0,
      "harness-error": 0,
      "verifier-error": 0,
      "verification-failure": 0,
      "budget-exceeded": 0,
      "credential-missing": 0
    }
  },
  "run_results": [
    {
      "path": ".harness/outputs/run-results.jsonl",
      "media_type": "application/jsonl",
      "description": "Agent-run ledger summarized by this scoreboard."
    }
  ]
}
